{
  "optical_train": "esprit100_2600mm",
  "kind": "flat",
  "filter": "Ha",
  "exposure_s": 2.5,
  "gain": 100,
  "offset": 50,
  "binning": "1x1",
  "sensor_temp_c": -10.0,
  "rotator_pos": 31250,
  "night": "2026-09-24",
  "n_frames": 40,
  "sha256": "0c1d2e3f4a5b6c7d8e9f0a1b2c3d4e5f6a7b8c9d0e1f2a3b4c5d6e7f8a9b0c1d",
  "superseded": false
}
